{
  "protocolVersion": 2,
  "type": "challenge",
  "sessionId": "pipe-session-01J000000000000000",
  "desktopDeviceId": "desktop-device-001",
  "runtimeId": "runtime-01J00000000000000000000000",
  "revitInstanceId": "revit-01J00000000000000000000",
  "pluginPid": 4242,
  "pluginVersion": "5.0.0-alpha.1",
  "catalogHash": "8fd7b6886896779e596d8e90fc844b9ac166c9d8a5e0b2d3ac1870523a4536a5",
  "maxFrameBytes": 8388608,
  "clientNonce": "AAECAwQFBgcICQoLDA0ODxAREhMUFRYXGBkaGxwdHh8",
  "serverNonce": "ICEiIyQlJicoKSorLC0uLzAxMjM0NTY3ODk6Ozw9Pj8",
  "clientTimestampUnixMs": 1785067200000,
  "serverTimestampUnixMs": 1785067201000,
  "transcriptHash": "52da3dd3c82fd818210bea7662c4469c9f327b493bf58f8eddb7e8e008fd8bf7",
  "serverProof": "yEJAOhEq4t4-WMUuIcZC6sJyUujftNUZIlWkWUDdOLo"
}
